Product URL,Product Name,Product Price,Rating,Number of reviews,Manufacturer,ASIN
https://www.amazon.in//sspa/click?ie=UTF8&spc=MTo2NjI0MDIxODkxODE4MDc2OjE3MzEwNDMxMzA6c3BfYXRmX25leHQ6MjAwNzg2NDQyNTg1MDc6OjA6Og&url=%2FSafari-Laptop-Backpack-Resistant-Fabric%2Fdp%2FB09B28TKLG%2Fref%3Dsr_1_33_sspa%3Fcrid%3D2M096C61O4MLT%26dib%3DeyJ2IjoiMSJ9.FCT_XwFKIGZhQ-_UXI7UHumCKXrWTL6cKbpuY0xvugCRysblE8PmMB8krpLRwnlK3Wt3PMRyIsTttUsOyBe2z9vh7UWRDuIfMEffm6hmYFW-V00DMaAlvtFXRtRwmo8MxqJHygvBgSOAtqwemEoQQJ9h5w_8PUQByrnEkIZRiCJQ_7Z7yd8GWoMH8VHyIVAukCoB9a-5s8wO7PgI45Gk_dGqbx-HMb2Pxmy05nVQwNg.Njlkkn2Gr7rLLYVTWRaRaBhU7Mu8Nty20GTHa7lW6ss%26dib_tag%3Dse%26keywords%3Dbags%26qid%3D1731043130%26sprefix%3Dba%252Caps%252C283%26sr%3D8-33-spons%26sp_csd%3Dd2lkZ2V0TmFtZT1zcF9hdGZfbmV4dA%26psc%3D1,"SAFARI Quirk Laptop Backpack, compartments, premium polyester fabric, bottle holder, school bag for boys and girls, college bag for women and men, office bag, travel bag  ",₹649,4.0 out of 5 stars,"2,643","Safari, 302-303, A Wing, The Qube CTS No.1498, A/2, Sir Mathuradas Vasanji Rd, Marol, Andheri East, Mumbai, Maharashtra 400059",B09B28TKLG
https://www.amazon.in//sspa/click?ie=UTF8&spc=MTo2NjI0MDIxODkxODE4MDc2OjE3MzEwNDMxMzA6c3BfYXRmX25leHQ6MjAxNTIzODIzMjAzOTg6OjA6Og&url=%2FArtistix-Backpack-Anti-Theft-Charging-Resistance%2Fdp%2FB082PKX18C%2Fref%3Dsr_1_34_sspa%3Fcrid%3D2M096C61O4MLT%26dib%3DeyJ2IjoiMSJ9.FCT_XwFKIGZhQ-_UXI7UHumCKXrWTL6cKbpuY0xvugCRysblE8PmMB8krpLRwnlK3Wt3PMRyIsTttUsOyBe2z9vh7UWRDuIfMEffm6hmYFW-V00DMaAlvtFXRtRwmo8MxqJHygvBgSOAtqwemEoQQJ9h5w_8PUQByrnEkIZRiCJQ_7Z7yd8GWoMH8VHyIVAukCoB9a-5s8wO7PgI45Gk_dGqbx-HMb2Pxmy05nVQwNg.Njlkkn2Gr7rLLYVTWRaRaBhU7Mu8Nty20GTHa7lW6ss%26dib_tag%3Dse%26keywords%3Dbags%26qid%3D1731043130%26sprefix%3Dba%252Caps%252C283%26sr%3D8-34-spons%26sp_csd%3Dd2lkZ2V0TmFtZT1zcF9hdGZfbmV4dA%26psc%3D1,"Artistix Talon Anti Theft Design Laptop Backpack Suitable upto 15.6 inch laptop size, With USB Charging Port (46 Cm, 25L,Black)  ","₹1,197",4.2 out of 5 stars,"5,273","Durant International. Address : GIDC Lodhika, Rajkot-360021, Gujarat. Customer Care : 9809804990, Durant International Plot no. G-2613/2 GIDC lodhika, metoda, Rajkot 360021. Customer Care +91 9809804990",B082PKX18C
https://www.amazon.in//Aristocrat-Nova-Laptop-Backpack-School/dp/B0D8BG7S4P/ref=sr_1_35?crid=2M096C61O4MLT&dib=eyJ2IjoiMSJ9.FCT_XwFKIGZhQ-_UXI7UHumCKXrWTL6cKbpuY0xvugCRysblE8PmMB8krpLRwnlK3Wt3PMRyIsTttUsOyBe2z9vh7UWRDuIfMEffm6hmYFW-V00DMaAlvtFXRtRwmo8MxqJHygvBgSOAtqwemEoQQJ9h5w_8PUQByrnEkIZRiCJQ_7Z7yd8GWoMH8VHyIVAukCoB9a-5s8wO7PgI45Gk_dGqbx-HMb2Pxmy05nVQwNg.Njlkkn2Gr7rLLYVTWRaRaBhU7Mu8Nty20GTHa7lW6ss&dib_tag=se&keywords=bags&qid=1731043130&sprefix=ba%2Caps%2C283&sr=8-35,Aristocrat Nova Laptop Backpack - Black/School bag  ,₹409,3.9 out of 5 stars,69,"VIP Industries Limited, DGP House, 88C, Old Prabhadevi Road, Prabhadevi, Mumbai 400025. India, VIP Industries Limited, DGP House, 88C, Old Prabhadevi Road, Prabhadevi, Mumbai 400025. India",B0D8BG7S4P
https://www.amazon.in//Number-Backpack-Compartment-Charging-Organizer/dp/B09VTC876Z/ref=sr_1_36?crid=2M096C61O4MLT&dib=eyJ2IjoiMSJ9.FCT_XwFKIGZhQ-_UXI7UHumCKXrWTL6cKbpuY0xvugCRysblE8PmMB8krpLRwnlK3Wt3PMRyIsTttUsOyBe2z9vh7UWRDuIfMEffm6hmYFW-V00DMaAlvtFXRtRwmo8MxqJHygvBgSOAtqwemEoQQJ9h5w_8PUQByrnEkIZRiCJQ_7Z7yd8GWoMH8VHyIVAukCoB9a-5s8wO7PgI45Gk_dGqbx-HMb2Pxmy05nVQwNg.Njlkkn2Gr7rLLYVTWRaRaBhU7Mu8Nty20GTHa7lW6ss&dib_tag=se&keywords=bags&qid=1731043130&sprefix=ba%2Caps%2C283&sr=8-36,"FUR JADEN Anti Theft Number Lock Backpack Bag with 15.6 Inch Laptop Compartment, USB Charging Port & Organizer Pocket for Men Women Boys Girls  ",₹699,4.0 out of 5 stars,"5,366","FUR JADEN, Fur Jaden, 3C Jai Hind Bld, Dr AM Road, Bhuleshwar, Mumbai 400002",B09VTC876Z
https://www.amazon.in//Safari-compartments-organizers-Resistant-Backpack/dp/B0D8QBZVZC/ref=sr_1_37?crid=2M096C61O4MLT&dib=eyJ2IjoiMSJ9.FCT_XwFKIGZhQ-_UXI7UHumCKXrWTL6cKbpuY0xvugCRysblE8PmMB8krpLRwnlK3Wt3PMRyIsTttUsOyBe2z9vh7UWRDuIfMEffm6hmYFW-V00DMaAlvtFXRtRwmo8MxqJHygvBgSOAtqwemEoQQJ9h5w_8PUQByrnEkIZRiCJQ_7Z7yd8GWoMH8VHyIVAukCoB9a-5s8wO7PgI45Gk_dGqbx-HMb2Pxmy05nVQwNg.Njlkkn2Gr7rLLYVTWRaRaBhU7Mu8Nty20GTHa7lW6ss&dib_tag=se&keywords=bags&qid=1731043130&sprefix=ba%2Caps%2C283&sr=8-37,"Safari Surge Laptop Bag, 30 Ltrs, 2 Compartments, 2 Front Smart Organizers, Water Resistant, College Bag for Men & Women, School Bags for Boys & Girls, Laptop/Office Backpack for Men & Women  ",₹799,4.2 out of 5 stars,165,"Safari, Safari Industries Ltd 301/302, A-Wing, The Qube, M.V.Road, Marol, Andheri(East), Near International Airport Mumbai- 400059, Phone Number: +91-22-40381851/838, Email ID: customercare@safari.in",B0D8QBZVZC
https://www.amazon.in//BIGBERRY-Backpack-Multiple-Compartments-organiser/dp/B0CQRB1NX8/ref=sr_1_38?crid=2M096C61O4MLT&dib=eyJ2IjoiMSJ9.FCT_XwFKIGZhQ-_UXI7UHumCKXrWTL6cKbpuY0xvugCRysblE8PmMB8krpLRwnlK3Wt3PMRyIsTttUsOyBe2z9vh7UWRDuIfMEffm6hmYFW-V00DMaAlvtFXRtRwmo8MxqJHygvBgSOAtqwemEoQQJ9h5w_8PUQByrnEkIZRiCJQ_7Z7yd8GWoMH8VHyIVAukCoB9a-5s8wO7PgI45Gk_dGqbx-HMb2Pxmy05nVQwNg.Njlkkn2Gr7rLLYVTWRaRaBhU7Mu8Nty20GTHa7lW6ss&dib_tag=se&keywords=bags&qid=1731043130&sprefix=ba%2Caps%2C283&sr=8-38,BIGBERRY Newage Rodeo 28 Ltrs leatherite/faux leather Backpack with Multiple Compartments & organiser  ,₹836.07,4.2 out of 5 stars,350,"EVON ENTERPRISES, 8595758076",B0CQRB1NX8
https://www.amazon.in//Aristocrat-Enigma-Polyester-Softsided-Duffle/dp/B0CWSCT2VJ/ref=sr_1_39?crid=2M096C61O4MLT&dib=eyJ2IjoiMSJ9.FCT_XwFKIGZhQ-_UXI7UHumCKXrWTL6cKbpuY0xvugCRysblE8PmMB8krpLRwnlK3Wt3PMRyIsTttUsOyBe2z9vh7UWRDuIfMEffm6hmYFW-V00DMaAlvtFXRtRwmo8MxqJHygvBgSOAtqwemEoQQJ9h5w_8PUQByrnEkIZRiCJQ_7Z7yd8GWoMH8VHyIVAukCoB9a-5s8wO7PgI45Gk_dGqbx-HMb2Pxmy05nVQwNg.Njlkkn2Gr7rLLYVTWRaRaBhU7Mu8Nty20GTHa7lW6ss&dib_tag=se&keywords=bags&qid=1731043130&sprefix=ba%2Caps%2C283&sr=8-39,Aristocrat Enigma 52 Cm Polyester Softsided Cabin Size Duffle Bag - Red  ,₹520,4.0 out of 5 stars,103,"VIP Industries Limited, DGP House, 88C, Old Prabhadevi Road, Prabhadevi, Mumbai 400025. India, VIP Industries Limited, DGP House, 88C, Old Prabhadevi Road, Prabhadevi, Mumbai 400025. India",B0CWSCT2VJ
https://www.amazon.in//Wesley-Milestone-Waterproof-Backpack-Business/dp/B085S444JV/ref=sr_1_40?crid=2M096C61O4MLT&dib=eyJ2IjoiMSJ9.FCT_XwFKIGZhQ-_UXI7UHumCKXrWTL6cKbpuY0xvugCRysblE8PmMB8krpLRwnlK3Wt3PMRyIsTttUsOyBe2z9vh7UWRDuIfMEffm6hmYFW-V00DMaAlvtFXRtRwmo8MxqJHygvBgSOAtqwemEoQQJ9h5w_8PUQByrnEkIZRiCJQ_7Z7yd8GWoMH8VHyIVAukCoB9a-5s8wO7PgI45Gk_dGqbx-HMb2Pxmy05nVQwNg.Njlkkn2Gr7rLLYVTWRaRaBhU7Mu8Nty20GTHa7lW6ss&dib_tag=se&keywords=bags&qid=1731043130&sprefix=ba%2Caps%2C283&sr=8-40,"Wesley Milestone 2.0 Casual Waterproof Laptop Backpack/Office Bag/School Bag/College Bag/Travel Backpack (Dimensions:13x18 inches) (Compatible with 39.62cm(15.6inch Laptop) 30 L, Charcoal Black  ",₹449,4.2 out of 5 stars,"17,014",Wesley,B085S444JV
